Title,Authors,Abstract,Published Year,Published Month,Journal,Volume,Issue,Pages,Accession Number,DOI,Ref,Covidence #,Study,Notes,Tags
State of Artemisinin and Partner Drug Susceptibility in Plasmodium falciparum Clinical Isolates,"Montenegro, Lidia Madeline; de Las Salas, Briegel; Neal, Aaron T.; Tobon-Castano, Alberto; Fairhurst, Rick M.; Lopera-Mesa, Tatiana M.","Delayed parasite clearance time observed in Southeast Asia provided the first evidence of Plasmodium falciparum resistance to artemisinins. The ex vivo ring-stage survival assay (RSA) mimics parasite exposure to pharmacologically relevant artemisinin concentrations. Mutations in the C-terminal propeller domain of the putative kelch protein Pf3D7_1343700 (K13) are associated with artemisinin resistance. Variations in the pfmdr1 gene are associated with reduced susceptibility to the artemisinin partner drugs mefloquine (MQ) and lumefantrine (LF). To clarify the unknown landscape of artemisinin resistance in Colombia, 71 patients with uncomplicated P. falciparum malaria were enrolled in a non-randomized observational study in three endemic localities in 2014-2015. Each patient's parasite isolate was assessed for ex vivo RSA, K13-propeller mutations, pfmdr1 copy number, and pfmdr1 mutations at codons 86,184,1034, 1042, and 1246, associated with reduced susceptibility, and 50% inhibitory concentration (IC50) for other antimalarial drugs. Ex vivo RSAs were successful in 56% (40/71) of samples, and nine isolates showed survival rates > 1%. All isolates had wild-type K13-propeller sequences. All isolates harbored either of two pfmdr1 haplotypes, NFSDD (79.3%) and NFSDY (20.7%), and 7.1% of isolates had > 1 pfmdr1 gene. In vitro IC50 assays showed that variable proportions of isolates had decreased susceptibility to chloroquine (52.4%, > 100 nM), amodiaquine (31.2%, > 30 nM), MQ (34.3%, > 30 nM), and LF (3.2%, > 10 nM). In this study, we report ex vivo RSA and K13 data on P. falciparum isolates from Colombia. The identification of isolates with increased ex vivo RSA rates in the absence of K13-propeller mutations and no positivity at day three requires further investigation.",2021,Jan,American Journal of Tropical Medicine and Hygiene,104,1,263-270,WOS:000615234800043,10.4269/ajtmh.20-0148,,#8368,Montenegro 2021,Exclusion reason: Duplicate; Sumayyah Rashan (2021-08-16 23:24:42)(Select): duplicate of #3869; ,Jul-21
State of Artemisinin and Partner Drug Susceptibility in Plasmodium falciparum Clinical Isolates from Colombia,"Montenegro, L. M.; de Las Salas, B.; Neal, A. T.; Tobon-Castano, A.; Fairhurst, R. M.; Lopera-Mesa, T. M.","Delayed parasite clearance time observed in Southeast Asia provided the first evidence of Plasmodium falciparum resistance to artemisinins. The ex vivo ring-stage survival assay (RSA) mimics parasite exposure to pharmacologically relevant artemisinin concentrations. Mutations in the C-terminal propeller domain of the putative kelch protein Pf3D7_1343700 (K13) are associated with artemisinin resistance. Variations in the pfmdr1 gene are associated with reduced susceptibility to the artemisinin partner drugs mefloquine (MQ) and lumefantrine (LF). To clarify the unknown landscape of artemisinin resistance in Colombia, 71 patients with uncomplicated P. falciparum malaria were enrolled in a non-randomized observational study in three endemic localities in 2014-2015. Each patient's parasite isolate was assessed for ex vivo RSA, K13-propeller mutations, pfmdr1 copy number, and pfmdr1 mutations at codons 86, 184, 1034, 1042, and 1246, associated with reduced susceptibility, and 50% inhibitory concentration (IC<sub>50</sub>) for other antimalarial drugs. Ex vivo RSAs were successful in 56% (40/71) of samples, and nine isolates showed survival rates > 1%. All isolates had wild-type K13-propeller sequences. All isolates harbored either of two pfmdr1 haplotypes, NFSDD (79.3%) and NFSDY (20.7%), and 7.1% of isolates had > 1 pfmdr1 gene. In vitro IC<sub>50</sub> assays showed that variable proportions of isolates had decreased susceptibility to chloroquine (52.4%, > 100 nM), amodiaquine (31.2%, > 30 nM), MQ (34.3%, > 30 nM), and LF (3.2%, > 10 nM). In this study, we report ex vivo RSA and K13 data on P. falciparum isolates from Colombia. The identification of isolates with increased ex vivo RSA rates in the absence of K13-propeller mutations and no positivity at day three requires further investigation.",2021,01,American Journal of Tropical Medicine & Hygiene,104,1,263-270,33289466,https://dx.doi.org/10.4269/ajtmh.20-0148,,#8369,Montenegro 2021,Exclusion reason: Less than 28 days follow-up; ,Jul-21
CYP2D6 Genetic Variation and Its Implication for Vivax Malaria Treatment in Madagascar,"Mehlotra, R. K.; Gaedigk, A.; Howes, R. E.; Rakotomanga, T. A.; Ratsimbasoa, A. C.; Zimmerman, P. A.","Plasmodium vivax is one of the five human malaria parasite species, which has a wide geographical distribution and can cause severe disease and fatal outcomes. It has the ability to relapse from dormant liver stages (hypnozoites), weeks to months after clearance of the acute blood-stage infection. An 8-aminoquinoline drug primaquine (PQ) can clear the hypnozoites, and thus can be used as an anti-relapse therapeutic agent. Recently, a number of studies have found that its efficacy is compromised by polymorphisms in the cytochrome P450 2D6 (CYP2D6) gene; decreased or absence of CYP2D6 activity contributes to PQ therapeutic failure. The present study sought to characterize CYP2D6 genetic variation in Madagascar, where populations originated from admixture between Asian and African populations, vivax malaria is endemic, and PQ can be deployed soon to achieve national malaria elimination. In a total of 211 samples collected from two health districts, CYP2D6 decreased function alleles CYP2D6*10, *17, *29, *36+*10, and *41 were observed at frequencies of 3.55-17.06%. In addition, nonfunctional alleles were observed, the most common of which were CYP2D6*4 (2.13%), *5 (1.66%), and the *4x2 gene duplication (1.42%). Given these frequencies, 34.6% of the individuals were predicted to be intermediate metabolizers (IM) with an enzyme activity score (AS) <= 1.0; both the IM phenotype and AS <= 1.0 have been found to be associated with PQ therapeutic failure. Furthermore, the allele and genotype frequency distributions add to the archaeological and genomic evidence of Malagasy populations constituting a unique, Asian-African admixed origin. The results from this exploratory study provide fresh insights about genomic characteristics that could affect the metabolism of PQ into its active state, and may enable optimization of PQ treatment across human genetic diversity, which is critical for achieving P. vivax elimination.",2021,,Frontiers in Pharmacology,12,,654054,33959023,https://dx.doi.org/10.3389/fphar.2021.654054,,#8519,Mehlotra 2021,Exclusion reason: Healthy volunteer; ,Jul-21
Does parasitemia level increase the risk of acute kidney injury in patients with malaria? Results from an observational study in Angola,"Manuel Sacomboio, Euclides Nenga; Sebastiao, Cruz dos Santos; Tchivango, Adelino Tchilanda; Pecoits-Filho, Roberto; Calice-Silva, Viviane","Background: The incidence of Acute Kidney Injury (AKI) due malaria has increased and in low and middle-income countries with negative impact in the death and hospitalization. The aim of this study was to evaluate AKI incidence and effects of parasitemia levels in the kidney function of patients hospitalized with malaria in Josina Machel hospital from March to May 2016. Methods: A longitudinal, prospective and observational study was performed with 135 patients hospitalized with malaria during the study period. Patients were followed-up and monitored by measurements of serum creatinine (SCr) and Blood Urea Nitrogen (SUr) for a period between 2 and 4 days. The diagnosis of AKI and Acute Kidney Disease (AKD) was carried out according to Kidney Disease Improving Global Outcomes (AKI-KDIGO) criteria. Additionally, information regarding blood parasite concentration and antimalarial treatment used was collected for all patients. Results: A total of 86 patients fulfilled the inclusion criteria and were enrolled in the study. From which, 61/86 (71%) were males, with mean age of 21.3 years. A total of 36/86 (42%) were with AKI in different stages. Interestingly, it was observed that high and hyper parasitemia were present in patients with AKI. The quinine was the anti-malarial most used in patients with AKI (54%). The hospitalization length 21/40(78%) and mortality 7/8(88%) rate was higher in patients with high and hyper parasitemia and AKI. Conclusion: We observed high and hyper parasitemia in patients with different stages of AKI. The hospitalization length and mortality rates were higher in this group of patients, especially in the more advanced stages of kidney injury. Further studies are needed to depth the consistency of the relationship between parasitemia and kidney injury to help control the emergence of kidney injury of the malaria patients in Angola. (C) 2019 The Authors. Published by Elsevier B.V. on behalf of African Institute of Mathematical Sciences / Next Einstein Initiative.",2020,Mar,Scientific African,7,,,WOS:000658473100020,10.1016/j.sciaf.2019.e00232,,#8560,ManuelSacomboio 2020,Exclusion reason: Less than 28 days follow-up; ,Jul-21
Diarrhea in Children with Plasmodium falciparum Malaria: A Case & ndash;Control Study on the Prevalence and Response to Antimalarial Treatment,"Lo Vecchio, Andrea; Basile, Francesca Wanda; Bruzzese, Dario; Di Dato, Fabiola; Aol, Pamella; Omona, Venice; Smarrazzo, Andrea; Guarino, Alfredo","The role of Plasmodium in the etiology of acute diarrhea in developing countries remains controversial, and gastrointestinal (GI) symptoms are inconsistently reported in malaria. In this observational case-control study, we investigated the prevalence and risk factors for GI symptoms in hospitalized malarious children aged 1 month to 5 years in northern Uganda. Children with a diagnosis of Plasmodium falciparum malaria were enrolled as cases, and feverish children in whom malaria was excluded were enrolled as controls. Among 451 malarious children, 46.1% had GI symptoms at admission. Compared with controls, the frequency of diarrhea (24.8% versus 11.2%, P < 0.001) and vomiting (35.5% versus 17.5%, P < 0.001) was significantly higher in children with malaria, who had a higher chance of showing either vomiting (odds ratio [OR]: 3.22; 95% CI: 2.14-4.91) or diarrhea (OR: 3.14; 95% CI: 1.99-5.07) at hospital admission. A subgroup analysis performed in children with severe malaria, severe anemia, or high-grade fever confirmed these results. Diarrhea was more frequent in infants and children younger than 3 years than in older children. The analysis of 71 malarious children with diarrhea who received intravenous artesunate showed that the symptom resolved within the first 24 hours since the beginning of the treatment in 85.9% of cases. The 3-fold higher prevalence of diarrhea and vomiting in malarious children compared with febrile controls may provide rationale for incorporating malaria testing in the symptom-guided diagnostic approach of the young child with diarrhea and vomiting in malaria-endemic settings.",2021,Feb,American Journal of Tropical Medicine and Hygiene,104,2,659-665,WOS:000651201600050,10.4269/ajtmh.20-0287,,#8757,LoVecchio 2021,Exclusion reason: Retrospective study; ,Jul-21
Diarrhea in Children with Plasmodium falciparum Malaria: A Case-Control Study on the Prevalence and Response to Antimalarial Treatment,"Lo Vecchio, A.; Basile, F. W.; Bruzzese, D.; Di Dato, F.; Aol, P.; Omona, V.; Smarrazzo, A.; Guarino, A.","The role of Plasmodium in the etiology of acute diarrhea in developing countries remains controversial, and gastrointestinal (GI) symptoms are inconsistently reported in malaria. In this observational case-control study, we investigated the prevalence and risk factors for GI symptoms in hospitalized malarious children aged 1 month to 5 years in northern Uganda. Children with a diagnosis of Plasmodium falciparum malaria were enrolled as cases, and feverish children in whom malaria was excluded were enrolled as controls. Among 451 malarious children, 46.1% had GI symptoms at admission. Compared with controls, the frequency of diarrhea (24.8% versus 11.2%, P < 0.001) and vomiting (35.5% versus 17.5%, P < 0.001) was significantly higher in children with malaria, who had a higher chance of showing either vomiting (odds ratio [OR]: 3.22; 95% CI: 2.14-4.91) or diarrhea (OR: 3.14; 95% CI: 1.99-5.07) at hospital admission. A subgroup analysis performed in children with severe malaria, severe anemia, or high-grade fever confirmed these results. Diarrhea was more frequent in infants and children younger than 3 years than in older children. The analysis of 71 malarious children with diarrhea who received intravenous artesunate showed that the symptom resolved within the first 24 hours since the beginning of the treatment in 85.9% of cases. The 3-fold higher prevalence of diarrhea and vomiting in malarious children compared with febrile controls may provide rationale for incorporating malaria testing in the symptom-guided diagnostic approach of the young child with diarrhea and vomiting in malaria-endemic settings.",2020,Dec-14,American Journal of Tropical Medicine & Hygiene,14,,14,33319726,https://dx.doi.org/10.4269/ajtmh.20-0287,,#8758,LoVecchio 2020,Exclusion reason: Duplicate; Sumayyah Rashan (2021-08-16 23:28:26)(Select): Duplicate of #8757 - LoVecchio 2021; ,Jul-21
"Glucose-6-phosphate dehydrogenase activity in individuals with and without malaria: Analysis of clinical trial, cross-sectional and case-control data from Bangladesh","Ley, B.; Alam, M. S.; Kibria, M. G.; Marfurt, J.; Phru, C. S.; Ami, J. Q.; Thriemer, K.; Auburn, S.; Jahan, N.; Johora, F. T.; Hossain, M. S.; Koepfli, C.; Khan, W. A.; Price, R. N.","BACKGROUND: Glucose-6-phosphate dehydrogenase (G6PD) activity is dependent upon G6PD genotype and age of the red blood cell (RBC) population, with younger RBCs having higher activity. Peripheral parasitemia with Plasmodium spp. induces hemolysis, replacing older RBCs with younger cells with higher G6PD activity. This study aimed to assess whether G6PD activity varies between individuals with and without malaria or a history of malaria.METHODS AND FINDINGS: Individuals living in the Chittagong Hill Tracts of Bangladesh were enrolled into 3 complementary studies: (i) a prospective, single-arm clinical efficacy trial of patients (n = 175) with uncomplicated malaria done between 2014 and 2015, (ii) a cross-sectional survey done between 2015 and 2016 (n = 999), and (iii) a matched case-control study of aparasitemic individuals with and without a history of malaria done in 2020 (n = 506). G6PD activity was compared between individuals with and without malaria diagnosed by microscopy, rapid diagnostic test (RDT), or polymerase chain reaction (PCR), and in aparasitemic participants with and without a history of malaria. In the cross-sectional survey and clinical trial, 15.5% (182/1,174) of participants had peripheral parasitemia detected by microscopy or RDT, 3.1% (36/1,174) were positive by PCR only, and 81.4% (956/1,174) were aparasitemic. Aparasitemic individuals had significantly lower G6PD activity (median 6.9 U/g Hb, IQR 5.2-8.6) than those with peripheral parasitemia detected by microscopy or RDT (7.9 U/g Hb, IQR 6.6-9.8, p < 0.001), but G6PD activity similar to those with parasitemia detected by PCR alone (submicroscopic parasitemia) (6.1 U/g Hb, IQR 4.8-8.6, p = 0.312). In total, 7.7% (14/182) of patients with malaria had G6PD activity < 70% compared to 25.0% (248/992) of participants with submicroscopic or no parasitemia (odds ratio [OR] 0.25, 95% CI 0.14-0.44, p < 0.001). In the case-control study, the median G6PD activity was 10.3 U/g Hb (IQR 8.8-12.2) in 253 patients with a history of malaria and 10.2 U/g Hb (IQR 8.7-11.8) in 253 individuals without a history of malaria (p = 0.323). The proportion of individuals with G6PD activity < 70% was 11.5% (29/253) in the cases and 15.4% (39/253) in the controls (OR 0.7, 95% CI 0.41-1.23, p = 0.192). Limitations of the study included the non-contemporaneous nature of the clinical trial and cross-sectional survey.CONCLUSIONS: Patients with acute malaria had significantly higher G6PD activity than individuals without malaria, and this could not be accounted for by a protective effect of G6PD deficiency. G6PD-deficient patients with malaria may have higher than expected G6PD enzyme activity and an attenuated risk of primaquine-induced hemolysis compared to the risk when not infected.",2021,Apr,PLoS Medicine / Public Library of Science,18,4,e1003576,33891581,https://dx.doi.org/10.1371/journal.pmed.1003576,,#9170,Ley 2021,Exclusion reason: Secondary analysis; ,Jul-21
Determinants of parasite clearance time among plasmodium knowlesi patients in Malaysia,"Kwong, K. S.; Islahudin, F.; Wen, C.","Plasmodium (P.) knowlesi infection was only recently discovered in 2004, and since then the number of cases has increased each year. As such, there is still a need to understand the clinical management of P. knowlesi infection to ensure control of the disease. Therefore, this work was performed to determine factors that affect the clinical outcome of P. knowlesi infected patients. A cross-sectional study from 2012 to 2016 was conducted in Hospital Kuala Lipis, Pahang, Malaysia. The main clinical outcome was parasite clearance. A total of 72 P. knowlesi patients were included, which were mostly male (n=56, 77.80%), with a mean age of 37.39+/-14.61 years. Fifty-six patients (77.80%) were prescribed with artemisinin-based antimalarial following diagnosis, while the remaining patients (n=16, 22.20%) were treated with chloroquine. The length for parasite clearance of P. knowlesi was 4(4-5) days [(median (IQR)]. Factors that affect the primary outcome of the study (>4 days for parasite clearance) was then determined. A multivariate logistic regression demonstrated that significant predictors of parasite clearance were initial parasite levels and number of symptoms (chi<sup>2</sup>=11.97, df(69), P=0.003). Those with an initial parasite count of > 2 400/uL were 4.8 times more likely to take > 4 days for parasite clearance (P=0.02). Having < 4 other symptoms increased the odds of > 4 days for parasite clearance by 0.14 times (P=0.02). This study shows the need to closely monitor patients with higher initial parasite counts (> 2400/uL) and patients with > 4 other symptoms associated with P. knowlesi infection, to ensure appropriate treatment is administered. Copyright © 2020, Informatics Publishing Limited. All rights reserved.",2020,,Asian Journal of Pharmaceutical Research and Health Care,12,4,234-241,,http://dx.doi.org/10.18311/ajprhc/2019/25332,,#9278,Kwong 2020,Exclusion reason: Retrospective study; ,Jul-21
Artemisinin Activity in Red Blood Cells from Anemic Children,"Joof, F.; Goheen, M. M.; Cerami, C.","Artemisinin combination therapies are the current frontline therapy for falciparum malaria. Artemisinin is activated by heme iron, and the consequent production of reactive oxygen species and carbon-centered radicals results in rapid parasite clearance. Red blood cells (RBCs) from anemic iron-deficient individuals have decreased levels of heme, and such deficiencies are highly prevalent among children and pregnant women in malaria-endemic countries. We, therefore, investigated the possibility that host anemia could impair artemisinin activity and alter the drug sensitivity of artemisinin-resistant strains of Plasmodium falciparum. We collected RBCs from anemic (n = 35) and nonanemic (n = 11) Gambian children between the ages of 2 and 24 months. Parasites grown in RBCs from both groups were assessed in vitro using the ring-stage survival assay with artemisinin-resistant and artemisinin-sensitive strains of P. falciparum. No differences were found in artemisinin sensitivity (P > 0.05), and there was no correlation between artemisinin activity and host hemoglobin levels. Standard antimalarial drug activity assays for representatives of the major classes of antimalarial drugs found no differences in the IC<sub>50</sub> values against P. falciparum between anemic and nonanemic RBCs. We conclude that host anemia does not influence artemisinin activity.",2021,01,American Journal of Tropical Medicine & Hygiene,104,1,271-275,33169662,https://dx.doi.org/10.4269/ajtmh.20-0304,,#9389,Joof 2021,Exclusion reason: Not assessing efficacy of antimalarial drug; ,Jul-21
Ex vivo susceptibility of Plasmodium falciparum to antimalarial drugs in Northern Uganda,"Fukuda, N.; Tachibana, S. I.; Ikeda, M.; Sakurai-Yatsushiro, M.; Balikagala, B.; Katuro, O. T.; Yamauchi, M.; Emoto, S.; Hashimoto, M.; Yatsushiro, S.; Sekihara, M.; Mori, T.; Hirai, M.; Opio, W.; Obwoya, P. S.; Auma, M. A.; Anywar, D. A.; Kataoka, M.; Palacpac, N. M. Q.; Odongo-Aginya, E. I.; Kimura, E.; Ogwang, M.; Horii, T.; Mita, T.","In Uganda, artemether-lumefantrine was introduced as an artemisinin-based combination therapy (ACT) for malaria in 2006. We have previously reported a moderate decrease in ex vivo efficacy of lumefantrine in Northern Uganda, where we also detected ex vivo artemisinin-resistant Plasmodium falciparum. Therefore, it is necessary to search for candidate partner alternatives for ACT. Here, we investigated ex vivo susceptibility to four ACT partner drugs as well as quinine and chloroquine, in 321 cases between 2013 and 2018. Drug-resistant mutations in pfcrt and pfmdr1 were also determined. Ex vivo susceptibility to amodiaquine, quinine, and chloroquine was well preserved, whereas resistance to mefloquine was found in 45.8%. There were few cases of multi-drug resistance. Reduced sensitivity to mefloquine and lumefantrine was significantly associated with the pfcrt K76 wild-type allele, in contrast to the association between chloroquine resistance and the K76T allele. Pfmdr1 duplication was not detected in any of the cases. Amodiaquine, a widely used partner drug for ACT in African countries, may be the first promising alternative in case lumefantrine resistance emerges. Therapeutic use of mefloquine may not be recommended in this area. This study also emphasizes the need for sustained monitoring of antimalarial susceptibility in Northern Uganda to develop proper treatment strategies.",2021,Apr,Parasitology International,81,,102277,33370608,https://dx.doi.org/10.1016/j.parint.2020.102277,,#9744,Fukuda 2021,Exclusion reason: Not assessing efficacy of antimalarial drug; ,Jul-21
A novel deep learning-based point-of-care diagnostic method for detecting Plasmodium falciparum with fluorescence digital microscopy,"Holmstrom, O.; Stenman, S.; Suutala, A.; Moilanen, H.; Kucukel, H.; Ngasala, B.; Martensson, A.; Mhamilawa, L.; Aydin-Schmidt, B.; Lundin, M.; Diwan, V.; Linder, N.; Lundin, J.","BACKGROUND: Malaria remains a major global health problem with a need for improved field-usable diagnostic tests. We have developed a portable, low-cost digital microscope scanner, capable of both brightfield and fluorescence imaging. Here, we used the instrument to digitize blood smears, and applied deep learning (DL) algorithms to detect Plasmodium falciparum parasites.METHODS: Thin blood smears (n = 125) were collected from patients with microscopy-confirmed P. falciparum infections in rural Tanzania, prior to and after initiation of artemisinin-based combination therapy. The samples were stained using the 4',6-diamidino-2-phenylindole fluorogen and digitized using the prototype microscope scanner. Two DL algorithms were trained to detect malaria parasites in the samples, and results compared to the visual assessment of both the digitized samples, and the Giemsa-stained thick smears.RESULTS: Detection of P. falciparum parasites in the digitized thin blood smears was possible both by visual assessment and by DL-based analysis with a strong correlation in results (r = 0.99, p < 0.01). A moderately strong correlation was observed between the DL-based thin smear analysis and the visual thick smear-analysis (r = 0.74, p < 0.01). Low levels of parasites were detected by DL-based analysis on day three following treatment initiation, but a small number of fluorescent signals were detected also in microscopy-negative samples.CONCLUSION: Quantification of P. falciparum parasites in DAPI-stained thin smears is feasible using DL-supported, point-of-care digital microscopy, with a high correlation to visual assessment of samples. Fluorescent signals from artefacts in samples with low infection levels represented the main challenge for the digital analysis, thus highlighting the importance of minimizing sample contaminations. The proposed method could support malaria diagnostics and monitoring of treatment response through automated quantification of parasitaemia and is likely to be applicable also for diagnostics of other Plasmodium species and other infectious diseases.",2020,,PLoS ONE [Electronic Resource],15,11,e0242355,33201905,https://dx.doi.org/10.1371/journal.pone.0242355,,#9891,Holmstrom 2020,Exclusion reason: Not assessing efficacy of antimalarial drug; ,Jul-21
