Title,Authors,Abstract,Published Year,Published Month,Journal,Volume,Issue,Pages,Accession Number,DOI,Ref,Covidence #,Study,Notes,Tags
"Trial flow chart, patients randomization and treatment assignment in Lisungi, Kinshasa, DR Congo","Ntamba, Yves Lula; Mavoko, Hypolite Muhindo; Kalabuanga, Marion; Fungula, Blaise; Nsengi, Pierre-Michel Ntamabyaliro; Lutete, Gaston Tona; Da Luz, Raquel Inocencio; Van Geertruyden, Jean-Pierre; Lutumba, Pascal","Trial flow chart, patients randomization and treatment assignment in Lisungi, Kinshasa, DR Congo. Copyright: CC BY 4.0",2019,20-11-2019,Figshare,,,,DRCI:DATA2020032017723701,http://dx.doi.org/10.1371/journal.pone.0222379.g001,,#3195,Ntamba 2019,Exclusion reason: Figure/Table/Supplementary data; ,
Treatment outcome analysis of Artemisinin based therapy in Plasmodium falciparum infection: An observational study,"Priya, D. A.; Meena Kumari, K.; Varma, M.; Mohanbabu, V. A.; Adiga, S.; Balaji, O.; Vanishree, R.","Currently, the preferred treatment for chloroquine (CQ) resistant Plasmodium falciparum (Pf) is Artemisinin combination therapy (ACT). Our aim was to assess the artemisinin based treatment outcomes in patients with Plasmodium falciparum infection. Patients with falciparum infection from a tertiary health care centre in South India were enrolled in this study. It was a non-randomised observational study. The data regarding peripheral blood smear, complete blood count, liver, renal function tests and the treatment given was documented at admission and on the day of discharge. Patients with uncomplicated falciparum malaria were most common. Artesunate and doxycycline was the most common combination used at our centre (54.6%) followed by artemether -lumefantrine. All patients had peripheral smear negative for Plasmodium falciparum parasite by the end of treatment. There was improvement in blood count,liver and renal function tests. Artemisinin based combination therapy was effective in treatment of falciparum malaria. Copyright © 2018 Oriental Scientific Publishing Company.",2018,December,Biomedical and Pharmacology Journal,11,4,1857-1863,626743915,http://dx.doi.org/10.13005/bpj/1558,,#3207,Priya 2018,Exclusion reason: Retrospective study; ,
Treatment of Uncomplicated Childhood Malaria in Tanzania by Artemether+Lumefantrine - Efficacy and Genotyping,,,,,,,,,,,,#3208,,Exclusion reason: Not assessing efficacy of antimalarial drug; ,
Tafenoquine versus Primaquine to Prevent Relapse of Plasmodium vivax Malaria,"Watson, J. A.; Taylor, A. R.",,2019,05 09,New England Journal of Medicine,380,19,1875-1876,31067384,https://dx.doi.org/10.1056/NEJMc1902327,,#3267,Watson 2019,Exclusion reason: Correspondence; ,
"Surveillance of genetic markers associated with Plasmodium falciparum resistance to artemisinin-based combination therapy in Pakistan, 2018-2019","Khan, A. Q.; Pernaute-Lau, L.; Khattak, A. A.; Luijcx, S.; Aydin-Schmidt, B.; Hussain, M.; Khan, T. A.; Mufti, F. U.; Morris, U.","BACKGROUND: The spread of artemisinin resistance in the Greater Mekong Subregion of Southeast Asia poses a significant threat for current anti-malarial treatment guidelines globally. The aim of this study was to assess the current prevalence of molecular markers of drug resistance in Plasmodium falciparum in the four provinces with the highest malaria burden in Pakistan, after introducing artemether-lumefantrine as first-line treatment in 2017.METHODS: Samples were collected during routine malaria surveillance in Punjab, Sindh, Baluchistan, and Khyber Pakhtunkhwa provinces of Pakistan between January 2018 and February 2019. Plasmodium falciparum infections were confirmed by rapid diagnostic test or microscopy. Plasmodium falciparum positive isolates (n = 179) were screened by Sanger sequencing for single nucleotide polymorphisms (SNPs) in the P. falciparum kelch 13 (pfk13) propeller domain and in P. falciparum coronin (pfcoronin). SNPs in P. falciparum multidrug resistance 1 (pfmdr1) N86Y, Y184F, D1246Y and P. falciparum chloroquine resistance transporter (pfcrt) K76T were genotyped by PCR-restriction fragment length polymorphism.RESULTS: No artemisinin resistance associated SNPs were identified in the pfk13 propeller domain or in pfcoronin. The pfmdr1 N86, 184F, D1246 and pfcrt K76 alleles associated with reduced lumefantrine sensitivity were present in 83.8% (150/179), 16.9% (29/172), 100.0% (173/173), and 8.4% (15/179) of all infections, respectively. The chloroquine resistance associated pfcrt 76T allele was present in 98.3% (176/179) of infections.CONCLUSION: This study provides an update on the current prevalence of molecular markers associated with reduced P. falciparum sensitivity to artemether and/or lumefantrine in Pakistan, including a first baseline assessment of polymorphisms in pfcoronin. No mutations associated with artemisinin resistance were observed in pfk13 or pfcoronin. However, the prevalence of the pfmdr1 N86 and D1246 alleles, that have been associated with decreased susceptibility to lumefantrine, remain high. Although clinical and molecular data suggest that the current malaria treatment guidelines for P. falciparum are presently effective in Pakistan, close monitoring for artemisinin and lumefantrine resistance will be critical to ensure early detection and enhanced containment of emerging ACT resistance spreading across from Southeast Asia.",2020,Jun-08,Malaria Journal,19,1,206,32513171,https://dx.doi.org/10.1186/s12936-020-03276-8,,#3415,Khan 2020,Exclusion reason: Not assessing efficacy of antimalarial drug; ,
Surveillance of Effectiveness/Safety of Artemether-lumefantrine in Patients With Malaria,,,,,,,,,,,,#3416,,Exclusion reason: Retrospective study; ,
"Surveillance of antimalarial drug efficacy in Mangalore, Karnataka, South India","Maskeri, R.; Jain, A.; Ullal, S.; Shenoy, S.; Shenoy, D.; Rai, S.","Malaria continues to be a devastating disease in India and Mangalore is endemic to malaria. The aim was to assess antimalarial drug efficacy in Mangalore, South India by clinical and parasitological evaluation. This study was conducted at the Urban health centre and District hospital Mangalore. Clinical history and oral temperature were recorded in patients with microscopically confirmed malaria. Peripheral blood smear was done on day 0, 3, 7, 28 and parasite load was calculated. As per the WHO guidelines clinical response was classified as (i) Early Treatment Failure, (ii) Late Clinical Failure (LCF), (iii) Late Parasitological Failure (LPF) and (iv) Adequate clinical and parasitological response. Therapeutic Failure was considered if any of the above criteria was present. Eight hundred thirty two Plasmodium vivax, P. falciparum or mixed infection were identified and included. Six hundred fifty nine patients completed the 28 day follow up (79.2%) while one hundred and seventy three were lost to follow up. As per the policy of the National Vector Borne Disease Control Programme (NVBDCP) of India, P.vivax was treated with Chloroquine and Primaquine regimen, while P. falciparum and mixed infections were treated with ACT Artesunate+Sulphadoxine+Pyrimethamine and Primaquine regimen. There were a total of 6 cases of LCF out of which 3 cases of P.vivax infection later developed P. falciparum infection before day 28 with clinical symptoms suggesting LCF of P. falciparum to chloroquine. There was 1 case of P.vivax infection who later developed P.vivax infection again on day 15 suggesting LCF of P. vivax to chloroquine. There were 2 cases of P. falciparum infection which later developed P. falciparum infection again before day 28 suggesting LCF of P. falciparum to Artesunate+Sulphadoxine-Pyrimethamine. There were 14 cases of LPF out of which 11 were P. vivax infection with persistence of parasite on day 7; 3 of P. vivax infection who later developed P. falciparum infection on day 28 with no clinical symptoms suggesting LPF of P. falciparum to chloroquine. This study demonstrates an estimate of around 3% treatment failure to antimalarials in Mangalore.",2018,October,American Journal of Tropical Medicine and Hygiene,99 (4 Supplement),,84,627540185,,,#3419,Maskeri 2018,Exclusion reason: Conference abstract; ,
"To Evaluate the Efficacy, Safety, Tolerability and Pharmacokinetics of a Single Dose Regimen of Ferroquine and Artefenomel in Adults and Children With Uncomplicated Plasmodium Falciparum Malaria",,,,,,,,,,,,#3496,,Exclusion reason: Terminated; ,
"Therapeutic response to artemether lumefantrine among individuals with pure versus mixed plasmodium species infections in Kisumu county, Western Kenya","Chemwor, G.; Akala, H.; Opot, B.; Okoth, R.; Yedah, R.; Cheruiyot, A.; Onyango, I.; Juma, D.; Andagalu, B.; Managbanag, J. R.","Introduction: Information on non-falciparum species is scanty despite it being a cause of malaria cases among returning travellers. In Kenya, conventional methods focus on falciparum detection thus are less sensitive for detection of non-falciparum species. Aim(s): The aim of this study was to describe the therapeutic effects of artemether-lumefantrine for subjects who had mixed species compared to those with pure Plasmodium infections in Kisumu county, western Kenya. Method(s): Samples from individuals enrolled in an ACT efficacy study between 2013 and 2015 were analyzed. Speciation was done using real time polymerase chain reaction (rt-PCR) to detect Plasmodium falciparum (Pf), Plasmodium malariae (Pm), Plasmodium ovale curtisi (Poc) and Plasmodium ovale wallikeri (Pow) at days 0, 7, 14, 21, 35 and 42. Therapeutic response was evaluated using parasite clearance parameters as well using the World Health Organization criteria and compared with species composition of each subject/infection. Recurrent parasitemia for the subsequent time points specifically days 28 and 42 was also monitored. Result(s): Pure Pf 41 accounted for 83% (41/49) of the samples with 14% (7/49) having mixed infections (4; Pf and Pow, 2; Pf and Poc, and 1; Pf and Pm). The median parasite clearance slope half for pure Pf and mixed infections was 2.56 hours and 2.88 hours with ranges of (1.48-3.85) and (2.08-4.21). The median time taken to clear 99% of the parasite load was 21.79 and 23.68 for the pure and mixed infections respectively. There was no significant recurrence of parasitemia on days 28 and 42 classified as late parasitological failure (LPF), late clinical failure (LCF) or Adequate clinical & parasitological response (ACPR) between pure Pf and those with mixed infections. More samples processing is ongoing. Conclusion(s): Although the data from our findings indicate there is no significant effect of ACTs on non falciparum species, the marginal increase in these species observed by this study appear to argue for notable rise of cases of exported malaria globally. Continued monitoring of prevalence of non falciparum malaria during implementation of ACTs is therefore warranted as the country transitions to pre-elimination phase.",2019,September,Transactions of the Royal Society of Tropical Medicine and Hygiene,113 (Supplement 1),,S277,630554552,http://dx.doi.org/10.1093/trstmh/trz097,,#3526,Chemwor 2019,Exclusion reason: Conference abstract; ,
"Therapeutic response of single plasmodium falciparum species versus mixed species infections to artemether-lumefantrine as compared to other artemisinin combination therapies in kisumu county, western kenya","Chemwor, G. C.; Akala, H. M.; Opot, B. H.; Okoth, R. O.; Yedah, R. M.; Cheruiyot, A. C.; Onyango, I.; Juma, D. W.; Andagalu, B.; Managbanag, J. R.","Information on treatment outcomes of infections comprising nonfalciparum species is scanty despite it being reported to be responsible for around 25% of imported malaria from Africa. The recommended first line treatment in Africa is artemether-lumefantrine (AL) with dihyroartemisininpiperaquine (DHAPPQ) as second line whereas in Asia, artesunatemefloquine (ASMQ) is the preferred choice of treatment. The aim of this study was to compare the treatment outcomes of mixed Plasmodium species versus pure falciparum species infections during dosing with AL, DHAPPQ & ASMQ. Samples collected at hours 0, 4, 8, 24 and 30 from individuals enrolled in an ACT efficacy study in Kisumu County, Western Kenya, between 2013 and 2015 were analyzed for species composition using real time polymerase chain reaction (rt-PCR). The assay targeted detection of Plasmodium falciparum (Pf), Plasmodium malariae (Pm), Plasmodium ovale curtisi (Poc) and Plasmodium ovale wallikeri (Pow). Therapeutic response was evaluated using parasite clearance parameters as well using the World Health Organization criteria and compared with species composition of each infection. Recurrent parasitemia for the subsequent time points specifically hours 24 and 30 was also characterized to rule out re-infection. There was a steady decline in parasites for infections comprising Pf species alone following administration of AL and ASMQ as opposed to those comprising Pf and other species. Pow frequency persisted in the subjects treated with AL in all the time points with an increase at hour 8 whereas for ASMQ, it appeared at hour four and eight then cleared completely. Pm seems to have been cleared early at hours 4 and 8 for AL and ASMQ respectively. Data analysis for DHAPPQ is in progress. Obtaining more information and continued monitoring of non-falciparum malaria during implementation of ACTs is therefore warranted to advise clinical intervention and align them to solving challenges of increasing traveler malaria.",2019,November,American Journal of Tropical Medicine and Hygiene,101 (5 Supplement),,78-79,630644104,http://dx.doi.org/10.4269/ajtmh.abstract2019,,#3527,Chemwor 2019,Exclusion reason: Conference abstract; ,
Therapeutic efficacy of artesunate-amodiaquine and artemether-lumefantrine for the treatment of uncomplicated plasmodium falciparum malaria in children under five years in guinea,"Beavogui, A. H.; Delamou, A.; Fofana, A.; Camara, A.; Guilavogui, T.; Dos Santos Souza, S.; Grovogui, F. M.; Bouedouno, P.; Doumbouya, A.; Kelley, J.; Talundzic, E.; Sarr, A.; Plucinski, M. M.","Artemisinin-based combination therapy (ACT) is the first-line antimalarial treatment for uncomplicated Plasmodium falciparum infection in Guinea. This study prospectively evaluated the efficacy and tolerance of two ACTs used in the management of uncomplicated P. falciparum malaria cases in children under five years of age in two sites in Guinea. We conducted a two-arm, randomized therapeutic efficacy study evaluating artesunateamodiaquine (ASAQ) and artemether-lumefantrine (AL) during a 28-day follow-up period. Data were collected at two health centers (located in Labe and Maferinyah Health Districts) between August 2015 and April 2016. Parasites from pre-treatment and day-of-failure samples from late treatment failures were genotyped and compared using neutral microsatellite markers to distinguish recrudescences from reinfections. A total of 421 subjects were enrolled, including 212 in the ASAQ arm and 209 in the AL arm; eight patients were lost to follow-up. Seven adverse events were reported, including two deaths that were not drug related. No patients had detectable parasitaemia on day 3. Of 22 late treatment failures, 20 were classified as reinfections and 2 as recrudescences. Across both sites, the therapeutic efficacy before molecular correction was 96% (95% confidence interval: 92-98%) for ASAQ and 93% (89-96%) for AL, and after molecular correction it reached 100% (96-100%) for ASAQ and 99% (97-100%) for AL. The two therapeutic combinations were effective for the treatment of uncomplicated P. falciparum malaria in children under five years in Guinea. Surveillance should continue to detect early antimalarial drug resistance in Guinea's fixed sentinel sites.",2018,October,American Journal of Tropical Medicine and Hygiene,99 (4 Supplement),,314,627539289,,,#3535,Beavogui 2018,Exclusion reason: Conference abstract; ,
THERAPEUTIC EFFICACY OF ARTESUNATE-AMODIAQUINE AND ARTEMETHER-LUMEFANTRINE FOR THE TREATMENT OF UNCOMPLICATED <it>PLASMODIUM FALCIPARUM</it> MALARIA IN CHILDREN UNDER FIVE YEARS IN GUINEA,"Beavogui, Abdoul; Delamou, Alexandre; Fofana, Aissata; Camara, Alioune; Guilavogui, Timothe; Souza, Samaly; Grovogui, Fassou; Bouedouno, Patrice; Doumbouya, Abdoulaye; Kelley, Julia; Talundzic, Eldin; Sarr, Abdoulaye; Plucinski, Mateusz",,2018,2018,American Journal of Tropical Medicine and Hygiene,99,4,314-314,WOS:000461386603337,,,#3536,Beavogui 2018,Exclusion reason: Conference abstract; ,
"Therapeutic efficacy of artemether-lumefantrine for the treatment of uncomplicated plasmodium falciparum malaria in Colombia, 2018-2019","Olivera, M. J.; Guerra, A. P.; Cortes, L. J.; Horth, R.; Novoa, J.; De La Paz Ade, M.; Lucchi, N.; Ljolje, D.; Marquino, W.; Renteria, M.; Yurgaky, W.; De Oliveira, A. M.","Artemether-lumefantrine (AL) has been the first-line antimalarial treatment for uncomplicated Plasmodium falciparum malaria in Colombia since 2010. The World Health Organization (WHO) recommends evaluating antimalarial treatment regimens every three years in low-endemic countries to confirm efficacy. To assess the therapeutic efficacy of AL in uncomplicated P. falciparum-infected patients in Quibdo, Colombia, we conducted a 28-day trial following WHO and Pan-American Health Organization guidance for antimalarial efficacy surveillance. From July 2018 to February 2019, febrile patients >=5 years old with microscopically confirmed P. falciparum monoinfection and asexual parasitemia 250- 100,000 parasites/muL were enrolled and treated with a supervised 3-day course of AL. The primary endpoint was adequate clinical and parasitological response (ACPR) on Day 28. We used neutral microsatellites to differentiate reinfection and recrudescence during the follow-up. Out of 259 patients offered participation, 86 consented and were ultimately enrolled, two of those were lost to follow-up, and 84 (97.7%) reached a valid endpoint: treatment failure or ACPR. One patient had recurrent infection with low-level parasitemia (12 parasites/muL) on Day 28. The parasite responsible for this infection was not isolated on molecular testing; therefore, this patient was excluded from the microsatellitecorrected analysis. The uncorrected and microsatellite-corrected ACPR rates were 98.8 % (83/84) (95% confidence interval [CI]: 93.5-100%) and 100% (83/83) (95% CI: 95.7-100%), respectively. In addition, no patient remained positive on Day 3, which would signal delayed parasite clearance, commonly associated with artemisinin resistance. AL remains efficacious for falciparum malaria in Quibdo, Colombia. Due to the time and effort, 8 months in our study, required to conduct efficacy trials in low-endemic settings, routine use of molecular markers for antimalarial resistance could greatly expand the coverage of antimalarial drug efficacy monitoring.",2019,November,American Journal of Tropical Medicine and Hygiene,101 (5 Supplement),,81-82,630644500,http://dx.doi.org/10.4269/ajtmh.abstract2019,,#3541,Olivera 2019,Exclusion reason: Conference abstract; ,
Single Oral Dose Study of Atovaquone/Proguanil Hydrochloride Combination Tablets and Atovaquone Suspension,,,,,,,,,,,,#3565,,Exclusion reason: Healthy volunteer; ,
Single Low Dose Tafenoquine to Reduce P. Falciparum Transmission in Mali (NECTAR2),,,,,,,,,,,,#3573,,Exclusion reason: Healthy volunteer; ,
Signatures of divergent anti-malarial treatment responses in peripheral blood from adults and young children in Malawi,"Maurizio, Paul L.; Fuseini, Hubaida; Tegha, Gerald; Hosseinipour, Mina; De Paris, Kristina","BackgroundHeterogeneity in the immune response to parasite infection is mediated in part by differences in host genetics, gender, and age group. In infants and young children, ongoing immunological maturation often results in increased susceptibility to infection and variable responses to drug treatment, increasing the risk of complications. Even though significant age-associated effects on host cytokine responses to Plasmodium falciparum infection have been identified, age-associated effects on uncomplicated malaria infection and anti-malarial treatment remain poorly understood.MethodsIn samples of whole blood from a cohort of naturally infected malaria-positive individuals with non-severe falciparum malaria in Malawi (n=63 total; 34 infants and young children<2years old, 29 adults>18years old), blood cytokine levels and monocyte and dendritic cell frequencies were assessed at two timepoints: acute infection, and 4weeks post anti-malarial treatment. The effects of age group, gender, and timepoint were modeled, and the role of these factors on infection and treatment outcomes was evaluated.ResultsRegardless of treatment timepoint, in this population age was significantly associated with overall blood haemoglobin, which was higher in adults, and plasma nitric oxide metabolites, IL-10, and TNF levels, which were higher in young children. There was a significant effect of age on the haemoglobin treatment response, whereby after treatment, levels increased in young children and decreased in adults. Furthermore, there were significant age-associated effects on treatment response for overall parasite load, IFN-, and IL-12(p40), and these effects were gender-dependent. Significant age effects on the overall levels and treatment response of myeloid dendritic cell frequencies were observed. In addition, within each age group, results showed continuous age effects on gametocyte levels (Pfs16), TNF, and nitric oxide metabolites.ConclusionsIn a clinical study of young children and adults experiencing natural falciparum malaria infection and receiving anti-malarial treatment, age-associated signatures of infection and treatment responses in peripheral blood were identified. This study describes host markers that may indicate, and potentially contribute to, differential post-treatment outcomes for malaria in young children versus adults.",2019,Jun-24,Malaria Journal,18,,,WOS:000472961800004,10.1186/s12936-019-2842-7,,#3590,Maurizio 2019,Exclusion reason: Not assessing efficacy of antimalarial drug; ,
Serological Screen and Treat Trial for Plasmodium Vivax,"Nct,","This is a randomized controlled trial to evaluate an experimental serological diagnostic technique intended to identify people at high risk of having dormant malaria parasites in their liver. The study is designed to show a superiority of SSAT vs. routine care for the prevention of recurrent P. vivax infections. With the estimated prevalence of 20%, the investigators will have a power of >90% to detect a significant difference with the sample size of 350 children per group. The investigators will recruit 400 children per group to anticipate subject loss due to exclusion and drop out. After obtaining informed consent from their parents/legal guardians, 800 schoolchildren living in Malaka regency, West Timor, Indonesia, will be individually randomized to intervention (SSAT) or control (routine care) group. During enrollment, all participants will be tested with Pv serological test by point‐of‐care/POC and standard Luminex, and standard finger stick microscopic. Their hemoglobin (Hb) and Glucose‐6‐Phosphate Dehydrogenase (G6PD) level will be measured. Children with Hb level<9 g/dL and/or G6PD <4 U/g Hb (male) or <6 U/g Hb (female) will be excluded. In the intervention arm (SSAT), children who are seropositive by standard Luminex and/or LMF positive will be treated with dihydroartemisinin‐piperaquine (DHA‐PP) for 3 days according to national guideline and primaquine/PQ high dose (1 mg/kg BW/day for 7 days for Pv/Po, 0.25 mg/kg BW for Pf). In the control arm, children will be treated only when they show symptoms (body temperature>=36.5oC or history of fever within last 3 days) and proven positive by LMF. All treatment will be provided under direct supervision by the research team during which any adverse event/severe adverse event will be recorded. Hemoglobin level and urine will be monitored daily for 7 days of PQ administration. Post‐hoc qPCR detection will be performed to determine their initial malaria status. Several additional tests will also be performed to all participants during this initial screening: microscopic examination of shallow vasculature of the ankle (light microscopy‐skin/LMS), magneto‐optical detection of hemozoin and hemoglobinopathy screening. After enrollment, all children will be actively followed for 9 months every 4 weeks for post‐hoc assessment by qPCR. Anytime during this follow up period, children becoming acutely ill will be tested for malaria by LMF, and referred to Primary Health Center to receive treatment when positive. Furthermore, household members of these infected children will also be screened for malaria infection by LMF and post‐hoc LMS and qPCR. This family screening will be performed by 2x house visit (7‐10 AM and 7‐10 PM). Treatment will be given for those found positive by LMF regardless of their symptoms. Antimalarial treatment provided during this follow up period will be according to national standard guideline: 3 days of DHA‐PP plus PQ (single 0.25 mg/kg BW dose for Pf, daily 0.25 mg/kg BW dose for 14 days for Pv/Po). At the end of study, Pv serological test and LMF will be performed to all schoolchildren. Those found positive by LMF will be referred to Primary Health Center to receive treatment according to national standard guideline.",2020,,https://clinicaltrials.gov/show/NCT04223674,,,,CN-02079237,,,#3643,Nct 2020,Exclusion reason: Not assessing efficacy of antimalarial drug; ,
