Title,Authors,Abstract,Published Year,Published Month,Journal,Volume,Issue,Pages,Accession Number,DOI,Ref,Covidence #,Study,Notes,Tags
Molecular Surveillance of Artemisinin Resistance Markers and Impact on Treatment Outcome in Patients with Acute Uncomplicated Plasmodium falciparum Malaria in South-West Nigeria,"Pactr,","INTERVENTION: Artemether Lumefantrine Dihydroartemisinin Piperaquine tablet Negative control nil intervention CONDITION: ; Malaria Malaria PRIMARY OUTCOME: Treatment success or failure SECONDARY OUTCOME: Response of patient to treatment will be classified as follows: (i) adequate clinical and parasitological response (ACPR), (ii) late parasitological failure (LPF), (iii) late clinical failure (LCF) and (iv) early treatment failure (ETF), (v) Slow clearance will be defined as failure to clear parasitemia by day 3 (WHO, 2018). ; INCLUSION CRITERIA: (i) Age 1 to 15 years with symptoms compatible with acute uncomplicated Plasmodium falciparum infection (ii) P. falciparum parasitemia = 2,000 asexual forms of parasite per µL of blood, (iii) Body (axillary) temperature = 37.5°C, or history of fever within one to two days preceding presentation, (iv) Absence of other concomitant illnesses, (v) Absence of any history of antimalarial drug use within 2 weeks prior to presentation, (vi) Written informed consent from parents or guardians of participants.",2021,,https://trialsearch.who.int/Trial2.aspx?TrialID=PACTR202108584742856,,,,CN-02330633,,,#17084,Pactr 2021,Exclusion reason: Not assessing efficacy of antimalarial drug; ,
Evaluation of population diversity of Plasmodium falciparum isolates from children with uncomplicated infection during the adoption of artemisinin-based combination therapy in Nigeria,"Pactr,","INTERVENTION: Artemether Lumefantrine Dihydroartemisinin piperaquine CONDITION: ; Malaria Malaria PRIMARY OUTCOME: Responsiveness to drug treatment would be measured through Asexual parasite positivity, Parasite clearance time, Adequate clinical and parasitological response, terminal elimination halftime of asexual parasitaemia, area under curve of asexual parasitaemia, fever clearance time and anaemia recovery time. SECONDARY OUTCOME: Semi‐nested PCR amplification of 12 P. falciparum microsatellite loci will be used to determine the population diversity of isolates from children with uncomplicated infection. INCLUSION CRITERIA: Age History of fever or fever (temp > 37.5oC) Mono P. falciparum infection with asexual parasitemia of =2000 mL‐1 Written informed consent, including readiness to comply with follow‐up visits by the child’s parent or guardian.",2021,,https://trialsearch.who.int/Trial2.aspx?TrialID=PACTR202106708800075,,,,CN-02330581,,,#17088,Pactr 2021,Exclusion reason: Full-text not available; ,
The role of overdose and genetic polymorphism in the extrapyramidal reactions associated with artesunate/amodiaquine in Eritrea,"Russom, M.","Introduction: From 2012 to 2018, over 140 cases of extrapyramidal reactions associated with artesunate/amodiaquine (AS/AQ) tablet, mainly in children and younger adults, were reported to the Eritrean Pharmacovigilance Centre. This represents about 54% of such cases reported to the WHO global pharmacovigilance database. About 88% of the cases were hospitalized and reaction was life-threatening in several patients. Given the nature and seriousness of the reaction, the National Medicines and Food Administration (NMFA) in collaboration with the Communicable Disease Control Division (CDCD) of the Department of Public Health has been working to identify risk factors. The aim of this report is to share what investigations were carried out to identify risk factors and the risk minimization measures employed. Method(s): The age for body weight band of Eritreans was assessed using population data from the National Statistics Office. Data were reviewed by the experts from NMFA, CDCD and the World Health Organization (WHO). Moreover, sample of the Eritrea population was genotyped using PCR-RFLP in collaboration with the Uppsala University to rule out the effect of genetic polymorphism of CYP2 C8; amodiaquine slow metabolizers. Result(s): The median body weight of Eritreans aged 16-50 years was 46 kg for males and 43 kg for females. This showed that the global dose recommendation of AS/AQ tablet does not fit to the Eritrean population, and thus, several patients were taking overdoses, which could be one of the risk factors for the increased risk of extrapyramidal reactions. Upon molecular analysis, the allele frequencies of CYP2 C8*2 and *3 were found to be 5.9% (95% CI: 4.4-7.8) and 4.6% (95% CI: 3.2-6.3), respectively. Four out of the 17 patients with extrapyramidal reactions showed to be carriers of the alleles. As a risk minimization measure, the manufacturer issued a boxed warning, direct healthcare professionals communication, and revised the product information leaflet and summary of product characteristics to include extrapyramidal reactions as adverse effects of AS/AQ tablet. Furthermore, the Ministry of Health of Eritrea derived a new dosing regimen that suits the Eritrean population that is endorsed by the WHO. Revision of the malaria treatment protocol and sensitization of healthcare professionals and community health agents (CHAs) were instructed through trainings, circular letter and information bulletin. The awareness raising programmes were aimed at informing health workers to adhere to weight-based dosing instead of age, to follow the new age-based dosing regimen in case of unavailability of weighing balance, and avoid re-challenging patients with extrapyramidal reactions. Conclusion(s): In Eritrea, use of age-based AS/AQ tablet is likely to expose patients to overdose and thus weight-based dosing regimen is recommended. Moreover, CYP2 C8*2 and *3 frequencies among Eritreans were found to be intermediate between that documented for Caucasian and African populations. The fact that most of the cases with extrapyramidal reactions were not found to be carriers of CYP2 C8 minor alleles shows that such adverse effects can occur independent of these variants.",2022,,Therapeutic Advances in Drug Safety,13,,19-20,637070789,https://dx.doi.org/10.1177/2042098,,#17279,Russom 2022,Exclusion reason: Conference abstract; ,April2022; Not a therapeutic efficacy study
Artemether-lumefantrine treatment failure of uncomplicated Plasmodium falciparum malaria in travellers coming from Angola and Mozambique,"Silva-Pinto, A.; Domingos, J.; Cardoso, M.; Reis, A.; Benavente, E. D.; Caldas, J. P.; Conceicao, C.; Toscano, C.; Baptista-Fernandes, T.; Clark, T. G.; Mansinho, K.; Campino, S.; Nogueira, F.","The failure of artemisinin combination therapy (ACT) in malaria patients returning from endemic regions may be driven by parasite resistance to this treatment. ACT is used globally as the first-line treatment for Plasmodium falciparum malaria. However, artemisinin-resistant strains of P. falciparum have emerged and spread across Southeast Asia, with the risk of reaching high malaria burden regions in Africa and elsewhere. Here, we report on two malaria imported cases from Africa with possible parasite resistance to the ACT artemether-lumefantrine (AL). Case presentation: Two middle-aged males returning from Angola and Mozambique developed malaria symptoms in Portugal, where they were diagnosed and received treatment with AL as hospital inpatients. After apparent cure and discharge from hospital, these individuals returned to hospital showing signs of late clinical failure. Molecular analysis was performed across a number of drug resistance associated genes. No evidence of pfk13-mediated artemisinin resistance was found. Both subjects had complete parasite clearance after treatment with non-ACT antimalarials. Conclusion : Our case-studies highlights the need for close monitoring of signs of unsatisfactory antimalarial efficacy among AL treated patients and the possible implication of other genes or mutations in the parasite response to ACTs.",2021,Sep,International Journal of Infectious Diseases,110,,151-154,34242769,https://dx.doi.org/10.1016/j.ijid.2021.07.008,,#17416,Silva-Pinto 2021,Exclusion reason: Case report; ,April2022; Travellers
Efficacy and safety of artemether-lumefantrine and artesunate-amodiaquine in treating children with uncomplicated Plasmodium falciparum malaria in mainland Tanzania,"Syk, A.; Mork, L. G.; Mmbando, B.; Mhamilawa, L. E.; Ngasala, B.; Martensson, A.","OBJECTIVE The World Health Organization recommends frequent therapeutic efficacy studies to monitor and maintain effective antimalarials. The aim of this study was to be a part of the ongoing surveillance of artemether- lumefantrine (AL) and artesunate-amodiaquine (ASAQ), the currently recommended ACTs for the treatment of uncomplicated Plasmodium falciparum malaria in Tanzania. METHODS This study was conducted at 6 sentinel sites located in 6 different regions in mainland Tanzania (Mwanza, Kigoma, Mbeya, Mtwara, Tanga and Morogoro) between December 2018 and March 2020. Artemether- lumefantrine was studied at 4 sites and artesunate-amodiaquine at 3 sites. Children between 6 months and 10 years with uncomplicated P. falciparum malaria were treated with standard doses of respective treatment and monitored for 28 days. The main outcomes were polymerase chain reaction (PCR) uncorrected and corrected cure rates, day 3 parasitemia and safety. RESULTS A total of 612 patients were enrolled. 4 patients were lost to follow-up and 4 patients withdrawn during the study. The PCR-uncorrected adequate clinical and parasitological response (ACPR) for AL was 84.2% and PCR-corrected ACPR was 99.0%, with 3 recrudescent infections observed. 49 (14.3%) patients in the AL group had new infections during the follow-up. 1 patient had parasitemia on day 3. For ASAQ, the PCR-uncorrected ACPR was 98.9% and with 1 early treatment failure and 2 late clinical or parasitological failures. No deaths or severe adverse events were observed during the study. A total of 146 patients (23.9%) reported adverse events, the most common being cough, fever and abdominal pain. CONCLUSION This study showed that both AL and ASAQ were highly efficacious drugs with adequate safety profiles. However, AL treatment was associated with high rates of new infections.",2021,September,Tropical Medicine and International Health,26(SUPPL 1),,97,636199135,http://dx.doi.org/10.1111/tmi.13632,,#17505,Syk 2021,Exclusion reason: Conference abstract; ,April2022; Conference abstracts
Development of weight and age-based dosing of daily primaquine for radical cure of vivax malaria,"Taylor, W. R.; Hoglund, R. M.; Peerawaranun, P.; Nguyen, T. N.; Hien, T. T.; Tarantola, A.; von Seidlein, L.; Tripura, R.; Peto, T. J.; Dondorp, A. M.; Landier, J.; H. Nosten F; Smithuis, F.; Phommasone, K.; Mayxay, M.; Kheang, S. T.; Say, C.; Neeraj, K.; Rithea, L.; Dysoley, L.; Kheng, S.; Muth, S.; Roca-Feltrer, A.; Debackere, M.; Fairhurst, R. M.; Song, N.; Buchy, P.; Menard, D.; White, N. J.; Tarning, J.; Mukaka, M.","BACKGROUND: In many endemic areas, Plasmodium vivax malaria is predominantly a disease of young adults and children. International recommendations for radical cure recommend fixed target doses of 0.25 or 0.5 mg/kg/day of primaquine for 14 days in glucose-6-phosphate dehydrogenase normal patients of all ages. However, for many anti-malarial drugs, including primaquine, there is evidence that children have lower exposures than adults for the same weight-adjusted dose. The aim of the study was to develop 14-day weight-based and age-based primaquine regimens against high-frequency relapsing tropical P. vivax.METHODS: The recommended adult target dose of 0.5 mg/kg/day (30 mg in a 60 kg patient) is highly efficacious against tropical P. vivax and was assumed to produce optimal drug exposure. Primaquine doses were calculated using allometric scaling to derive a weight-based primaquine regimen over a weight range from 5 to 100 kg. Growth curves were constructed from an anthropometric database of 53,467 individuals from the Greater Mekong Subregion (GMS) to define weight-for-age relationships. The median age associated with each weight was used to derive an age-based dosing regimen from the weight-based regimen.RESULTS: The proposed weight-based regimen has 5 dosing bands: (i) 5-7 kg, 5 mg, resulting in 0.71-1.0 mg/kg/day; (ii) 8-16 kg, 7.5 mg, 0.47-0.94 mg/kg/day; (iii) 17-40 kg, 15 mg, 0.38-0.88 mg/kg/day; (iv) 41-80 kg, 30 mg, 0.37-0.73 mg/kg/day; and (v) 81-100 kg, 45 mg, 0.45-0.56 mg/kg/day. The corresponding age-based regimen had 4 dosing bands: 6-11 months, 5 mg, 0.43-1.0 mg/kg/day; (ii) 1-5 years, 7.5 mg, 0.35-1.25 mg/kg/day; (iii) 6-14 years, 15 mg, 0.30-1.36 mg/kg/day; and (iv) >= 15 years, 30 mg, 0.35-1.07 mg/kg/day.CONCLUSION: The proposed weight-based regimen showed less variability around the primaquine dose within each dosing band compared to the age-based regimen and is preferred. Increased dose accuracy could be achieved by additional dosing bands for both regimens. The age-based regimen might not be applicable to regions outside the GMS, which must be based on local anthropometric data. Pharmacokinetic data in small children are needed urgently to inform the proposed regimens.",2021,Sep-09,Malaria Journal,20,1,366,34503519,https://dx.doi.org/10.1186/s12936-021-03886-w,,#17528,Taylor 2021,Exclusion reason: Not assessing efficacy of antimalarial drug; ,April2022; Not a therapeutic efficacy study
Drug susceptibility of Plasmodium falciparum in eastern Uganda: a longitudinal phenotypic and genotypic study,"Tumwebaze, P. K.; Katairo, T.; Okitwi, M.; Byaruhanga, O.; Orena, S.; Asua, V.; Duvalsaint, M.; Legac, J.; Chelebieva, S.; Ceja, F. G.; Rasmussen, S. A.; Conrad, M. D.; Nsobya, S. L.; Aydemir, O.; Bailey, J. A.; Bayles, B. R.; Rosenthal, P. J.; Cooper, R. A.","BACKGROUND: Treatment and control of malaria depends on artemisinin-based combination therapies (ACTs) and is challenged by drug resistance, but thus far resistance to artemisinins and partner drugs has primarily occurred in southeast Asia. The aim of this study was to characterise antimalarial drug susceptibility of Plasmodium falciparum isolates from Tororo and Busia districts in Uganda.METHODS: In this prospective longitudinal study, P falciparum isolates were collected from patients aged 6 months or older presenting at the Tororo District Hospital (Tororo district, a site with relatively low malaria incidence) or Masafu General Hospital (Busia district, a high-incidence site) in eastern Uganda with clinical symptoms of malaria, a positive Giemsa-stained blood film for P falciparum, and no signs of severe disease. Ex-vivo susceptibilities to ten antimalarial drugs were measured using a 72-h microplate growth inhibition assay with SYBR Green detection. Relevant P falciparum genetic polymorphisms were characterised by molecular methods. We compared results with those from earlier studies in this region and searched for associations between drug susceptibility and parasite genotypes.FINDINGS: From June 10, 2016, to July 29, 2019, 361 P falciparum isolates were collected in the Busia district and 79 in the Tororo district from 440 participants. Of 440 total isolates, 392 (89%) successfully grew in culture and showed excellent drug susceptibility for chloroquine (median half-maximal inhibitory concentration [IC<sub>50</sub>] 20.0 nM [IQR 12.0-26.0]), monodesethylamodiaquine (7.1 nM [4.3-8.9]), pyronaridine (1.1 nM [0.7-2.3]), piperaquine (5.6 nM [3.3-8.6]), ferroquine (1.8 nM [1.5-3.3]), AQ-13 (24.0 nM [17.0-32.0]), lumefantrine (5.1 nM [3.2-7.7]), mefloquine (9.5 nM [6.6-13.0]), dihydroartemisinin (1.5 nM [1.0-2.0]), and atovaquone (0.3 nM [0.2-0.4]). Compared with results from our study in 2010-13, significant improvements in susceptibility were seen for chloroquine (median IC<sub>50</sub> 288.0 nM [IQR 122.0-607.0]; p<0.0001), monodesethylamodiaquine (76.0 nM [44.0-137]; p<0.0001), and piperaquine (21.0 nM [7.6-43.0]; p<0.0001), a small but significant decrease in susceptibility was seen for lumefantrine (3.0 nM [1.1-7.6]; p<0.0001), and no change in susceptibility was seen with dihydroartemisinin (1.3 nM [0.8-2.5]; p=0.64). Chloroquine resistance (IC<sub>50</sub>>100 nM) was more common in isolates from the Tororo district (11 [15%] of 71), compared with those from the Busia district (12 [4%] of 320; p=0.0017). We showed significant increases between 2010-12 and 2016-19 in the prevalences of wild-type P falciparum multidrug resistance protein 1 (PfMDR1) Asn86Tyr from 60% (391 of 653) to 99% (418 of 422; p<0.0001), PfMDR1 Asp1246Tyr from 60% (390 of 650) to 90% (371 of 419; p<0.0001), and P falciparum chloroquine resistance transporter (PfCRT) Lys76Thr from 7% (44 of 675) to 87% (364 of 417; p<0.0001).INTERPRETATION: Our results show marked changes in P falciparum drug susceptibility phenotypes and genotypes in Uganda during the past decade. These results suggest that additional changes will be seen over time and continued surveillance of susceptibility to key ACT components is warranted.FUNDING: National Institutes of Health and Medicines for Malaria Venture.",2021,Sep,The Lancet. Microbe,2,9,e441-e449,34553183,https://dx.doi.org/10.1016/s2666-5247(21)00085-9,,#17578,Tumwebaze 2021,Exclusion reason: Not assessing efficacy of antimalarial drug; ,April2022; Not a therapeutic efficacy study
Evaluation of cardiotoxicity and other adverse effects associated with concomitant administration of artemether/lumefantrine and atazanavir/ritonavir-based antiretroviral regimen in patients living with HIV,"Usman, S. O.; Oreagba, I. A.; Busari, A.; Akinyede, A.; Adewumi, O.; Kadri, M. R.; Hassan, O.; Fashina, Y. A.; Agbaje, E. O.; Akanmu, S. A.","The interplay of artemether-lumefantrine (AL) and atazanavir-ritonavir (ATVr) with Cytochrome P (CYP) 3A4 isoenzyme and QTc-interval may spawn clinically significant drug interactions when administered concomitantly. Cardiotoxicity and other adverse effects associated with interaction between AL and ATVr were evaluated in patients with HIV infection and malaria comorbidity. In a two-arm parallel study design, six doses of AL 80/480 mg were administered to 20 participants [control-arm (n = 10) and ATVr-arm (n = 10)], having uncomplicated Falciparum malaria, at intervals of 0, 8, 24, 36, 48 and 60 h respectively. Participants in the control arm took only AL while those in ATVr-arm took both AL and ATVr-based ART regimen. Electrocardiography, adverse events monitoring and blood tests were carried out for each of them at pre and post doses of AL. Data obtained were analyzed. QTc-interval was significantly increased in the ATVr-arm (0.4079 +/- 0.008 to 0.4215 +/- 0.007 s, p = 0.008) but not in the control-arm (0.4016 +/- 0.018 to 0.4024 +/- 0.014 s, p = 0.962). All values were, however, within normal range [0.36 - 0.44 / 0.46 s (male/female)]. General body weakness and chest pain were new adverse events reported, at post-dose of AL, in the ATVr-arm but not in the control-arm. There was no significant change (p > 0.05) in the plasma levels of creatinine, alanine aminotransferase, aspartate aminotransferase and hemoglobin at post-dose compared to pre-dose of AL in both arms of study. Concomitant administration of artemether-lumefantrine with atazanavir-ritonavir-based regimen is potentially cardiotoxic but not associated with clinically significant renal, blood nor liver toxicities. They must be used with caution. Copyright © 2022 The Author(s)",2022,,Saudi Pharmaceutical Journal.,,,,2017124873,https://dx.doi.org/10.1016/j.jsps.2022.02.010,,#17597,Usman 2022,Exclusion reason: Not assessing efficacy of antimalarial drug; ,April2022; HIV patients included; safety
"Evaluation of the effects of atazanavir-ritonavir on the pharmacokinetics of lumefantrine in patients living with HIV in Lagos University Teaching Hospital, South-Western Nigeria","Usman, S. O.; Oreagba, I. A.; Kadri, M. R.; Adewumi, O. O.; Akinyede, A.; Agbaje, E. O.; Abideen, G.; Busari, A. A.; Hassan, O. O.; Akinleye, M. O.; Akanmu, A. S.","PURPOSE: Atazanavir-ritonavir (ATVr)-based antiretroviral therapy and artemether-lumefantrine (AL) are commonly used drugs for the treatment of human immune deficiency virus (HIV) infection and malaria respectively. However, interaction of both drugs, with Cytochrome P 3A4 (CYP 3A4) isoenzyme, may spawn clinically significant pharmacokinetic interactions. This study evaluated the effects of atazanavir-ritonavir on the pharmacokinetics of lumefantrine.METHOD: In a case-control study, twenty participants having Plasmodium falciparum malaria were recruited and divided into two groups (ATVr-arm, n=10; and control-arm, n= 10). All the participants were administered six oral doses of AL 80-480 mg (Coartem). Thereafter, their blood samples were collected at different time intervals over seven days. The concentration of lumefantrine in each sample was quantified with high-performance liquid chromatography (HPLC) and used to determine its pharmacokinetic parameters which were compared between the test and control groups.RESULTS: ATVr increased the mean day 7 concentration of lumefantrine (ATVr 3847.09 +/- 893.35 ng/mL, control 1374.53 +/- 265.55 ng/mL, p = 0.016) and the area under its plasma concentration-time curve (ATVr 670529.57 +/- 157172.93 ng.h/mL, control 447976.28 +/- 80886.99 ng.h/mL, p = 0.224) by 179.88 % and 49.68 %, respectively, but decreased its mean maximum plasma drug concentration (Cmax) (ATVr 13725.70 +/- 2658.44 ng/mL, control 15380.48 +/- 2332.62 ng/mL, p = 0.645) by 10.76 %.CONCLUSION: ATVr increased drug exposure and day 7 plasma concentration of lumefantrine. AL is therefore considered effective for the treatment of malaria in patients taking ATVr-based regimen. However, the safety associated with the interaction requires further elucidation.TRIAL REGISTRATION: Clin ClinicalTrials.gov Identifier: NCT04531072, August 27, 2020. ""Retrospectively registered"".",2021,Sep,European journal of clinical pharmacology,77,9,1341-1348,33755736,https://dx.doi.org/10.1007/s00228-021-03116-x,,#17598,Usman 2021,Exclusion reason: Not assessing efficacy of antimalarial drug; ,April2022; HIV patients included; PK; Retrospective studies
Effectiveness and safety of artemether lumefantrine in malaria treatment at a regional referral hospital in Kenya,"Wakoli, P.; Opanga, S.; Karimi, P.","Background: Malaria is one of the leading causes of death especially in children under the age of 5 years and expectant mothers in Kenya and globally. Prompt diagnosis and treatment with Artemether-Lumefantrine (AL) has reduced the morbidity and mortality. Continuous exposure of the parasites to AL predisposes to resistance. The WHO recommended testing of the efficacy of AL every two years in endemic areas, which has necessitated this study. Objective(s): To determine the effectiveness and safety of Artemether-Lumefantrine in Bungoma County Referral Hospital in Kenya. Method(s): Participants on treatment with Artemether-Lumefantrine were randomly selected and followed up using mobile phone calls in a longitudinal study. Any adverse events were recorded. Data was analyzed both descriptively and inferentially using STATA version 13. Ethical approval was obtained from the University of Nairobi/Kenyatta National Hospital Ethics and Review Committee. Result(s): 260 malaria patients participated in the study, of which the majority were female, 53.5%. The age range was 1 month to 61 years and median of 36 months (3 years). AL was found to be effective against uncomplicated malaria. AL was generally well tolerated with only 23% of the patients reporting adverse events of which abdominal discomfort (43.3%, 26), cough (43.3%, 26) and headache (31.7%, 19). 5 patients reported blisters on the body, another 5 had swollen abdomen while 2 had yellow skin or blood in urine. Conclusion(s): AL is safe and effective against uncomplicated malaria in an endemic area in Kenya. The unusual adverse events reported during the study require further investigation.",2021,August,Pharmacoepidemiology and Drug Safety,30(SUPPL 1),,430,,http://dx.doi.org/10.1002/pds.5307,,#17656,Wakoli 2021,Exclusion reason: Conference abstract; ,April2022
